{
  "$schema": "./legacy-cutover-inventory.schema.json",
  "schemaVersion": 1,
  "inventoryId": "sskem-wordpress-cutover",
  "capturedOn": "2026-08-16",
  "sourceOrigin": "https://www.sskemschool.com",
  "policy": {
    "legacyContentIsEvidence": false,
    "legacyUploadsCopied": false,
    "redirectsMayPublishLegacyContent": false,
    "notes": "The inventory preserves route continuity only. Legacy copy, claims, images and downloads require fresh review through the existing approval controls."
  },
  "records": [
    {
      "id": "legacy-home",
      "title": "Home",
      "legacyPath": "/",
      "category": "home",
      "disposition": "retain",
      "targetPath": "/",
      "implementation": "current-route",
      "contentReview": "approval-blocked",
      "risk": "high",
      "ownerRole": "website-owner",
      "observedOn": "2026-08-16",
      "notes": "Keep the modern homepage route; do not copy the legacy slider, claims or uploads."
    },
    {
      "id": "legacy-saras",
      "title": "SARAS",
      "legacyPath": "/saras",
      "category": "disclosure",
      "disposition": "redirect",
      "targetPath": "/mandatory-public-disclosure",
      "implementation": "dedicated-route",
      "contentReview": "required",
      "risk": "medium",
      "ownerRole": "compliance-owner",
      "observedOn": "2026-08-16",
      "notes": "Route to the controlled disclosure hub; current affiliation evidence remains approval-bound."
    },
    {
      "id": "legacy-appendix-ix",
      "title": "OASIS / Appendix IX",
      "legacyPath": "/appendix-ix",
      "category": "disclosure",
      "disposition": "redirect",
      "targetPath": "/mandatory-public-disclosure",
      "implementation": "dedicated-route",
      "contentReview": "required",
      "risk": "medium",
      "ownerRole": "compliance-owner",
      "observedOn": "2026-08-16",
      "notes": "Route to the revised five-section disclosure hub without carrying forward old files."
    },
    {
      "id": "legacy-brief-of-school",
      "title": "Brief of School",
      "legacyPath": "/brief-of-school",
      "category": "about",
      "disposition": "redirect",
      "targetPath": "/about/school-overview",
      "implementation": "catch-all-redirect",
      "contentReview": "approval-blocked",
      "risk": "medium",
      "ownerRole": "school-management",
      "observedOn": "2026-08-16",
      "notes": "The modern overview deliberately withholds unverified history and programme claims."
    },
    {
      "id": "legacy-management",
      "title": "Board of Management",
      "legacyPath": "/management",
      "category": "about",
      "disposition": "redirect",
      "targetPath": "/about/governance",
      "implementation": "catch-all-redirect",
      "contentReview": "approval-blocked",
      "risk": "high",
      "ownerRole": "school-management",
      "observedOn": "2026-08-16",
      "notes": "Names and roles are not migrated until the current governance record is approved."
    },
    {
      "id": "legacy-school-management-committee",
      "title": "School Management Committee",
      "legacyPath": "/school-management-committee",
      "category": "about",
      "disposition": "redirect",
      "targetPath": "/about/governance",
      "implementation": "catch-all-redirect",
      "contentReview": "approval-blocked",
      "risk": "high",
      "ownerRole": "compliance-owner",
      "observedOn": "2026-08-16",
      "notes": "The committee list remains a controlled Appendix IX document requirement."
    },
    {
      "id": "legacy-vision-and-mission",
      "title": "Vision and mission",
      "legacyPath": "/vision-and-mission",
      "category": "about",
      "disposition": "redirect",
      "targetPath": "/about/school-overview",
      "implementation": "catch-all-redirect",
      "contentReview": "required",
      "risk": "medium",
      "ownerRole": "school-management",
      "observedOn": "2026-08-16",
      "notes": "Legacy wording requires editorial and management review before any migration."
    },
    {
      "id": "legacy-school-information",
      "title": "School Information",
      "legacyPath": "/school-information",
      "category": "disclosure",
      "disposition": "redirect",
      "targetPath": "/mandatory-public-disclosure",
      "implementation": "catch-all-redirect",
      "contentReview": "approval-blocked",
      "risk": "high",
      "ownerRole": "compliance-owner",
      "observedOn": "2026-08-16",
      "notes": "The legacy page mixes current and stale institutional claims; the disclosure hub remains authoritative."
    },
    {
      "id": "legacy-president-message",
      "title": "President Message",
      "legacyPath": "/about-us/president-message-2",
      "category": "about",
      "disposition": "redirect",
      "targetPath": "/about/leadership",
      "implementation": "catch-all-redirect",
      "contentReview": "approval-blocked",
      "risk": "high",
      "ownerRole": "school-management",
      "observedOn": "2026-08-16",
      "notes": "Identity, role, portrait and message require a current approved source."
    },
    {
      "id": "legacy-chairman-message",
      "title": "Chairman Message",
      "legacyPath": "/about-us/chairman-message",
      "category": "about",
      "disposition": "redirect",
      "targetPath": "/about/leadership",
      "implementation": "catch-all-redirect",
      "contentReview": "approval-blocked",
      "risk": "high",
      "ownerRole": "school-management",
      "observedOn": "2026-08-16",
      "notes": "Identity, role, portrait and message require a current approved source."
    },
    {
      "id": "legacy-principal-message",
      "title": "Principal Message",
      "legacyPath": "/about-us/principal-message",
      "category": "about",
      "disposition": "redirect",
      "targetPath": "/about/leadership",
      "implementation": "catch-all-redirect",
      "contentReview": "approval-blocked",
      "risk": "high",
      "ownerRole": "school-management",
      "observedOn": "2026-08-16",
      "notes": "The current principal identity must be reconciled before any legacy message is republished."
    },
    {
      "id": "legacy-guideline-procedure",
      "title": "Admission Guideline and Procedure",
      "legacyPath": "/guideline-procedure",
      "category": "admissions",
      "disposition": "redirect",
      "targetPath": "/admissions/process",
      "implementation": "dedicated-route",
      "contentReview": "required",
      "risk": "medium",
      "ownerRole": "admissions-office",
      "observedOn": "2026-08-16",
      "notes": "Route to current guarded admissions guidance."
    },
    {
      "id": "legacy-section-strength",
      "title": "Age Rule",
      "legacyPath": "/section-strength",
      "category": "admissions",
      "disposition": "redirect",
      "targetPath": "/admissions/age-criteria",
      "implementation": "dedicated-route",
      "contentReview": "approval-blocked",
      "risk": "high",
      "ownerRole": "admissions-office",
      "observedOn": "2026-08-16",
      "notes": "The target remains in manual-review mode until the current Maharashtra order is approved."
    },
    {
      "id": "legacy-student-enrolment",
      "title": "Student Enrollment",
      "legacyPath": "/student-enrolment",
      "category": "admissions",
      "disposition": "redirect",
      "targetPath": "/admissions",
      "implementation": "dedicated-route",
      "contentReview": "required",
      "risk": "medium",
      "ownerRole": "admissions-office",
      "observedOn": "2026-08-16",
      "notes": "Route to the parent-facing admissions hub without copying legacy counts or forms."
    },
    {
      "id": "legacy-registration-form",
      "title": "Registration Form",
      "legacyPath": "/registration-form",
      "category": "admissions",
      "disposition": "redirect",
      "targetPath": "/admissions/enquire",
      "implementation": "dedicated-route",
      "contentReview": "approval-blocked",
      "risk": "high",
      "ownerRole": "admissions-office",
      "observedOn": "2026-08-16",
      "notes": "The target is a non-submitting review prototype until protected admissions storage is active."
    },
    {
      "id": "legacy-admission-form",
      "title": "Admission Form",
      "legacyPath": "/admission-form",
      "category": "admissions",
      "disposition": "redirect",
      "targetPath": "/admissions/apply",
      "implementation": "dedicated-route",
      "contentReview": "approval-blocked",
      "risk": "high",
      "ownerRole": "admissions-office",
      "observedOn": "2026-08-16",
      "notes": "The target is a non-submitting review prototype until the formal application workflow is secured."
    },
    {
      "id": "legacy-leaving-certificate",
      "title": "Leaving Certificate / Transfer Certificate",
      "legacyPath": "/leaving-certificate",
      "category": "admissions",
      "disposition": "redirect",
      "targetPath": "/contact",
      "implementation": "catch-all-redirect",
      "contentReview": "approval-blocked",
      "risk": "high",
      "ownerRole": "school-office",
      "observedOn": "2026-08-16",
      "notes": "Do not expose legacy certificate searches or pupil records; route families to the school office."
    },
    {
      "id": "legacy-facilities",
      "title": "Facilities",
      "legacyPath": "/facilities",
      "category": "academics",
      "disposition": "redirect",
      "targetPath": "/school/facilities",
      "implementation": "catch-all-redirect",
      "contentReview": "approval-blocked",
      "risk": "medium",
      "ownerRole": "school-management",
      "observedOn": "2026-08-16",
      "notes": "Facility claims and images remain subject to physical verification and media approval."
    },
    {
      "id": "legacy-academic-calendar",
      "title": "Academic Calendar",
      "legacyPath": "/academic-calendar",
      "category": "academics",